{
  "wallet_id": "33333333-3333-4333-8333-333333333333",
  "schema_version": "1.0",
  "owner_account_id": "11111111-1111-4111-8111-111111111111",
  "wallet_type": "CUSTOMER",
  "first_seen_at": "2026-01-01T00:10:00Z",
  "risk_level": "LOW",
  "is_known_destination": true,
  "supported_assets": [
    "BTC",
    "ETH"
  ]
}
